CAFNet,2,452,simvastatin,30,0.33530168124250953,0.9176694329183955,0.21801641453242443,0.4,0.2,0.025873015873015874,,0.35770689923278126,0.12658153774072184,1.0,musculoskeletal discomfort; arthralgia; asthenia; nausea; abdominal pain,swelling; atrial fibrillation; diabetes mellitus; gastritis; regurgitation
CAFNet-D,2,452,simvastatin,30,0.525689087726162,0.9254840940525588,0.8048109992093389,0.6666666666666666,0.3333333333333333,0.033365570599613155,,0.5615852946605536,0.03627054327878419,1.0,headache; nausea; diarrhoea; dermatitis; rash,swelling; eczema; endocrine disorder; atrial fibrillation; diabetes mellitus
CAFNet-DG,2,452,simvastatin,30,0.519256647690332,0.9351659751037344,0.7534494445524138,0.6,0.3,0.03600464576074332,,0.5536147636700238,0.07096179965045057,1.0,nausea; headache; asthenia; diarrhoea; abdominal pain,swelling; eczema; atrial fibrillation; diabetes mellitus; endocrine disorder
CAFNet,2,467,exemestane,63,0.5233563852393465,0.8110326837501917,0.6947651160602988,0.8666666666666667,0.20634920634920634,0.012735505781515322,0.013258508227035703,0.621282215904819,0.03375875267143108,1.0,headache; dizziness; musculoskeletal discomfort; arthralgia; back pain,musculoskeletal pain; vaginal haemorrhage; increased appetite; dysphonia; menopausal symptoms
CAFNet-D,2,467,exemestane,63,0.6897582672300548,0.8956745605510374,1.0,1.0,0.23809523809523808,0.018982932776036226,0.023656861901895015,0.7920504655061664,0.12104265751414858,1.0,headache; nausea; dizziness; diarrhoea; vomiting,vaginal haemorrhage; menopausal symptoms; hot flush; influenza like illness; musculoskeletal pain
CAFNet-DG,2,467,exemestane,63,0.6804453107075119,0.8922476258673896,1.0,1.0,0.23809523809523808,0.022424768518518517,0.01985610244080059,0.7768360260693727,0.1274190339733994,1.0,headache; dizziness; nausea; asthenia; vomiting,vaginal haemorrhage; musculoskeletal pain; menopausal symptoms; hot flush; influenza like illness
CAFNet,2,480,ibandronic.acid,45,0.36014337096718685,0.8729656948835031,0.4990267326507382,0.5333333333333333,0.17777777777777778,,1.0,0.3794475970383555,0.1255358635275496,0.9333333333333333,nausea; abdominal pain; gastrointestinal pain; diarrhoea; constipation,gastroenteritis; influenza like illness; gastritis; oropharyngeal pain; oropharyngeal discomfort
CAFNet-D,2,480,ibandronic.acid,45,0.46085555708167886,0.8867579908675799,0.8611375561264455,0.7333333333333333,0.24444444444444444,,0.011627906976744186,0.4802441461990839,0.14801881382498133,1.0,nausea; vomiting; dizziness; diarrhoea; asthenia,angiopathy; skin disorder; influenza like illness; mental disorder; gamma-glutamyltransferase increased
CAFNet-DG,2,480,ibandronic.acid,45,0.43934853486361564,0.8983725559068024,0.7162874455029681,0.6666666666666666,0.2222222222222222,,0.01818181818181818,0.4554876062066076,0.12024437484461646,1.0,nausea; vomiting; diarrhoea; asthenia; dizziness,influenza like illness; skin disorder; angiopathy; gastritis; gastroenteritis
CAFNet,2,486,eprosartan,15,0.3129656144301096,0.9396663261831801,0.3675540416412887,0.3333333333333333,0.3333333333333333,,0.06222222222222222,0.3510847571222576,0.033460586576855855,1.0,cough; gastrointestinal pain; abdominal pain; asthenia; fatigue,viral infection; blood triglycerides increased; hypertriglyceridaemia
CAFNet-D,2,486,eprosartan,15,0.19391943515610255,0.9267960503915562,0.19930623359011795,0.3333333333333333,0.3333333333333333,,0.17829457364341084,0.21118622530305817,0.02754745317784845,1.0,abdominal pain; asthenia; gastrointestinal pain; fatigue; cough,blood triglycerides increased; viral infection; hypertriglyceridaemia
CAFNet-DG,2,486,eprosartan,15,0.2421334538450187,0.9398706162751107,0.28744763646920174,0.3333333333333333,0.3333333333333333,,0.26176470588235295,0.2663556208717122,0.02720469934484982,1.0,abdominal pain; gastrointestinal pain; asthenia; cough; fatigue,blood triglycerides increased; viral infection; hypertriglyceridaemia
CAFNet,2,500,brinzolamide,17,0.10831824365673556,0.7010355831175868,0.2200917662980802,0.06666666666666667,0.058823529411764705,0.01163676381252152,0.010303030303030303,0.14771298832924762,0.01496029392575483,1.0,headache; vision blurred; dyspnoea; rhinitis; cough,nasal congestion; dry eye; lacrimation increased; sinus congestion; asthma
CAFNet-D,2,500,brinzolamide,17,0.09873038413697048,0.7256306821602746,0.1388624438735545,0.06666666666666667,0.058823529411764705,0.02243079538201223,0.006274281274281274,0.1318029206782225,0.04506365196956089,1.0,headache; dyspnoea; cough; dysgeusia; rhinitis,nasal congestion; asthma; dry eye; keratitis; lacrimation increased
CAFNet-DG,2,500,brinzolamide,17,0.09012844552073093,0.7214160997049792,0.1388624438735545,0.06666666666666667,0.058823529411764705,0.019665253705613107,0.0065951916829109815,0.11963974047351714,0.024094330691859442,1.0,headache; dyspnoea; cough; vision blurred; rhinitis,nasal congestion; dry eye; asthma; keratitis; lacrimation increased
CAFNet,2,505,lanreotide,13,0.3170208496018068,0.8385085862150083,0.46945447024602927,0.3333333333333333,0.38461538461538464,,0.3499263555187333,0.3792525379608625,0.34013793745127324,0.8666666666666667,malnutrition; gastrointestinal pain; abdominal pain; diarrhoea; flatulence,malnutrition; cholelithiasis; sinus bradycardia; injection site pain; inflammation
CAFNet-D,2,505,lanreotide,13,0.1355993999187844,0.855877048537599,0.23992089480238074,0.2,0.23076923076923078,,0.03370788243029822,0.16711591375521842,0.036930693406090453,1.0,diarrhoea; abdominal pain; gastrointestinal pain; pain; flatulence,malnutrition; injection site pain; inflammation; cholelithiasis; sinus bradycardia
CAFNet-DG,2,505,lanreotide,13,0.20206172277657689,0.8759507566847017,0.2735872697693365,0.26666666666666666,0.3076923076923077,,0.18279761904761904,0.24782544596786082,0.2288397554169919,1.0,diarrhoea; abdominal pain; gastrointestinal pain; flatulence; pain,malnutrition; cholelithiasis; injection site pain; inflammation; sinus bradycardia
CAFNet,2,512,doripenem,17,0.39408083901713703,0.9210367872840026,0.550770786630823,0.4,0.35294117647058826,0.3333333333333333,,0.4199799644521975,0.06759165942047152,1.0,rash; dermatitis; pruritus; nausea; diarrhoea,phlebitis; clostridium difficile colitis; oral candidiasis; candida infection; colitis
CAFNet-D,2,512,doripenem,17,0.4283959561365409,0.9192606418206996,0.6520881886359191,0.4666666666666667,0.4117647058823529,0.07692307692307693,,0.45497897213830235,0.061541081909136035,1.0,nausea; headache; diarrhoea; dermatitis; rash,phlebitis; hepatic enzyme increased; candida infection; clostridium difficile colitis; oral candidiasis
CAFNet-DG,2,512,doripenem,17,0.47262937046814524,0.9249804322957432,0.7059054020403313,0.4,0.35294117647058826,0.1111111111111111,,0.50186389793689,0.11581693332098976,1.0,dermatitis; rash; nausea; pruritus; diarrhoea,phlebitis; candida infection; clostridium difficile colitis; hepatic enzyme increased; oral candidiasis
CAFNet,2,519,bexarotene,141,0.4450340911347968,0.7245682738436723,0.7215194105726964,0.8,0.0851063829787234,0.011870061622027816,0.07165633704650626,0.560424053125357,0.13899130947981425,0.9333333333333333,hyperhidrosis; insomnia; dry mouth; dry skin; alopecia,rash maculo-papular; dysuria; skin disorder; acne; cheilitis
CAFNet-D,2,519,bexarotene,141,0.49867893888630754,0.8194108403382304,1.0,0.9333333333333333,0.09929078014184398,0.017977829484341883,0.06787900948173167,0.6519391513152467,0.15959336880009728,1.0,nausea; vomiting; headache; dizziness; pruritus,skin disorder; acne; dysuria; dermatitis contact; rash maculo-papular
CAFNet-DG,2,519,bexarotene,141,0.5259141427355062,0.8149293690188155,1.0,0.8666666666666667,0.09219858156028368,0.016646646459343887,0.07062663371189543,0.6410876321784288,0.18047268294224944,1.0,nausea; headache; pruritus; vomiting; diarrhoea,rash maculo-papular; dysuria; skin disorder; acne; dermatitis contact
CAFNet,2,536,clofarabine,87,0.5749115708278375,0.884804014751169,0.9305687780632227,0.8666666666666667,0.14942528735632185,0.08526568578424927,0.18182866764026873,0.6646893573954398,0.26435015839823767,0.7333333333333333,sepsis; candida infection; anaemia; oral candidiasis; body temperature increased,sepsis; candida infection; oral candidiasis; bone pain; lymphopenia
CAFNet-D,2,536,clofarabine,87,0.6383889002215939,0.9104538138868824,1.0,1.0,0.1724137931034483,0.07987504759656658,0.20116091113620768,0.7327765430989399,0.19884020188109647,1.0,nausea; headache; diarrhoea; vomiting; dermatitis,lymphopenia; mucosal inflammation; sepsis; blood creatinine increased; candida infection
CAFNet-DG,2,536,clofarabine,87,0.6372965879464806,0.9127095768543512,1.0,1.0,0.1724137931034483,0.10735734173636369,0.23113305363567938,0.7275007284590573,0.28568081414153074,1.0,headache; nausea; diarrhoea; vomiting; body temperature increased,sepsis; candida infection; oral candidiasis; lymphopenia; bone pain
CAFNet,2,548,caspofungin,108,0.3787829471418328,0.7335559317782795,0.5964984284535196,0.6666666666666666,0.09259259259259259,0.0916481325013642,0.06716826064539766,0.4905366965744058,0.1527955167955693,1.0,musculoskeletal discomfort; infection; back pain; headache; myalgia,influenza like illness; nervous system disorder; skin disorder; infestation; mediastinal disorder
CAFNet-D,2,548,caspofungin,108,0.6122486381152992,0.8895472786556309,1.0,0.9333333333333333,0.12962962962962962,0.28763044740760874,0.23634317362378637,0.7331799186785842,0.42912191258841137,1.0,nausea; headache; vomiting; diarrhoea; dizziness,nervous system disorder; angiopathy; skin disorder; mediastinal disorder; malnutrition
CAFNet-DG,2,548,caspofungin,108,0.5393836328449004,0.8692417021988128,1.0,1.0,0.1388888888888889,0.23823668788650743,0.16889788707223402,0.6530450292058325,0.3040969867007424,1.0,headache; nausea; diarrhoea; dizziness; vomiting,nervous system disorder; skin disorder; infestation; influenza like illness; mediastinal disorder
CAFNet,2,560,pomalidomide,59,0.4405508350929234,0.9438502673796791,0.16421958630632805,0.4666666666666667,0.11864406779661017,,0.12269839970052876,0.4735045991970523,0.1212338133180507,0.6666666666666666,tremor; decreased appetite; muscular weakness; pneumonia; headache,muscular weakness; febrile neutropenia; hyponatraemia; sepsis; lymphopenia
CAFNet-D,2,560,pomalidomide,59,0.6608395716488422,0.9537569110849271,0.933745776545611,0.8,0.2033898305084746,,0.09384734866462441,0.6932806613893404,0.175124681615091,1.0,nausea; headache; vomiting; diarrhoea; dizziness,sepsis; blood creatinine increased; febrile neutropenia; hypocalcaemia; musculoskeletal pain
CAFNet-DG,2,560,pomalidomide,59,0.6572151690158069,0.9574730354391371,0.8630152897016883,0.8666666666666667,0.22033898305084745,,0.20700380705679186,0.6856653979596381,0.19540967951006477,1.0,nausea; headache; diarrhoea; dizziness; vomiting,muscular weakness; febrile neutropenia; sepsis; blood creatinine increased; hyponatraemia
CAFNet,2,566,eplerenone,53,0.3017256020637024,0.7159384837487217,0.6470538417566039,0.5333333333333333,0.1509433962264151,,0.02091247537092874,0.3550674409182669,0.033903242497734784,0.8666666666666667,headache; dizziness; asthenia; fatigue; hyperhidrosis,influenza like illness; myocardial infarction; acute coronary syndrome; musculoskeletal pain; diabetes mellitus
CAFNet-D,2,566,eplerenone,53,0.3907569621255228,0.8463697792392677,0.8482378089219645,0.6666666666666666,0.18867924528301888,,0.017859611221344607,0.44096248536648447,0.08557135775078051,1.0,nausea; headache; vomiting; dizziness; diarrhoea,eosinophilia; renal failure; pulmonary oedema; influenza like illness; hyperkalaemia
CAFNet-DG,2,566,eplerenone,53,0.43378755016881476,0.8494175205020752,0.9363792118010483,0.7333333333333333,0.20754716981132076,,0.018911555635560837,0.48401735648144306,0.07761023755868789,1.0,headache; dizziness; nausea; vomiting; asthenia,influenza like illness; pulmonary oedema; eosinophilia; hyperkalaemia; renal failure
CAFNet,2,576,cinacalcet,29,0.35588386940206745,0.8655529748079329,0.33184124553682204,0.4666666666666667,0.2413793103448276,,0.016264918833103735,0.4099401958825178,0.005592548132308507,1.0,musculoskeletal discomfort; nausea; constipation; diarrhoea; asthenia,neoplasm malignant; multiple fractures; fracture; hypocalcaemia; hypercalcaemia
CAFNet-D,2,576,cinacalcet,29,0.48056133933155415,0.9021261390030374,0.7136540102475308,0.6666666666666666,0.3448275862068966,,0.01747622358149034,0.5495078130497615,0.007344585896604659,1.0,nausea; dizziness; vomiting; diarrhoea; asthenia,neoplasm malignant; hypocalcaemia; hypercalcaemia; multiple fractures; fracture
CAFNet-DG,2,576,cinacalcet,29,0.48461774153584253,0.8963015901375737,0.7065443116025597,0.6666666666666666,0.3448275862068966,,0.016298065576760102,0.5548458761424357,0.006789281689581756,1.0,nausea; dizziness; vomiting; diarrhoea; asthenia,neoplasm malignant; multiple fractures; fracture; hypocalcaemia; hypercalcaemia
CAFNet,2,577,lubiprostone,17,0.555448914389255,0.9192606418206996,0.6410457898283652,0.7333333333333333,0.6470588235294118,,,0.5633543899765511,0.007458105193296831,1.0,nausea; gastrointestinal pain; abdominal pain; dizziness; asthenia,abdominal discomfort; chest discomfort
CAFNet-D,2,577,lubiprostone,17,0.515642180578521,0.9428623035703534,0.6530488081313034,0.6666666666666666,0.5882352941176471,,,0.5212314512493496,0.007647357723577235,1.0,nausea; vomiting; dizziness; diarrhoea; asthenia,abdominal discomfort; chest discomfort
CAFNet-DG,2,577,lubiprostone,17,0.5236601226602285,0.9437654283822025,0.624232247406789,0.6666666666666666,0.5882352941176471,,,0.5275050253072616,0.008150183150183149,1.0,nausea; dizziness; vomiting; diarrhoea; abdominal pain,abdominal discomfort; chest discomfort
CAFNet,2,591,lapatinib,45,0.41689416790647066,0.9001990399250673,0.5483327772244703,0.6,0.2,1.0,0.05388165980915091,0.45772174335279625,0.0424113512192532,0.9333333333333333,pruritus; dry skin; decreased appetite; asthenia; fatigue,dermatitis acneiform; interstitial lung disease; nail disorder; menopausal symptoms; hot flush
CAFNet-D,2,591,lapatinib,45,0.6227262766768632,0.924645826015689,0.8630152897016883,0.8,0.26666666666666666,0.14285714285714285,0.30388632222800627,0.6918735015145231,0.08164154994116771,1.0,nausea; headache; vomiting; diarrhoea; rash,nail disorder; dermatitis acneiform; haemoglobin decreased; hyperbilirubinaemia; mucosal inflammation
CAFNet-DG,2,591,lapatinib,45,0.6219764075295787,0.9286968739023533,1.0,0.8666666666666667,0.28888888888888886,1.0,0.2862736258598811,0.6729362230564252,0.10533444880997264,1.0,pruritus; nausea; headache; diarrhoea; rash,dermatitis acneiform; nail disorder; interstitial lung disease; mucosal inflammation; hyperbilirubinaemia
CAFNet,2,604,gadoversetamide,17,0.38008835990709383,0.8907821060870612,0.5496754593904236,0.4666666666666667,0.4117647058823529,,,0.3919719575297016,0.12309272300469483,1.0,headache; nausea; dyspepsia; dermatitis; rash,injection site reaction; vasodilation procedure; ecchymosis
CAFNet-D,2,604,gadoversetamide,17,0.5115609117008423,0.9511710518393642,0.6618313225363276,0.6,0.5294117647058824,,,0.5156405844996184,0.07757027265406297,1.0,nausea; dizziness; headache; dermatitis; rash,injection site reaction; ecchymosis; vasodilation procedure
CAFNet-DG,2,604,gadoversetamide,17,0.5180453855230902,0.9566500090312481,0.7453016244178956,0.5333333333333333,0.47058823529411764,,,0.521770087681057,0.17862158908507222,1.0,nausea; headache; dermatitis; rash; diarrhoea,injection site reaction; ecchymosis; vasodilation procedure
CAFNet,2,613,telaprevir,32,0.189115227951745,0.7874870062370062,0.2329726085570737,0.4666666666666667,0.21875,0.021375545124671262,0.028876524285039774,0.24677882958026306,0.04443240814536598,1.0,nausea; diarrhoea; vomiting; dermatitis; rash,candida infection; oral candidiasis; eczema; eosinophilia; rectal haemorrhage
CAFNet-D,2,613,telaprevir,32,0.28313822874359973,0.7669243762993764,0.7136540102475308,0.5333333333333333,0.25,0.011743415586573613,0.022264442408327315,0.38222517302793174,0.0246413834020123,1.0,nausea; diarrhoea; vomiting; dizziness; dermatitis,candida infection; oral candidiasis; eosinophilia; eczema; hypothyroidism
CAFNet-DG,2,613,telaprevir,32,0.2654128957962082,0.7832640332640333,0.6253338941235215,0.5333333333333333,0.25,0.011417227067915656,0.023018805796986487,0.3537017705150759,0.033653093696377034,1.0,nausea; diarrhoea; vomiting; dermatitis; rash,candida infection; oral candidiasis; eczema; eosinophilia; rectal haemorrhage
CAFNet,2,635,verteporfin,19,0.13620819016418942,0.7224291497975708,0.3198747510605213,0.2,0.15789473684210525,0.011543657475838076,0.022614636066615644,0.20221640138768163,0.025770314340152603,1.0,nausea; pain; asthenia; body temperature increased; hypertension,hypercholesterolaemia; visual acuity reduced; injection site pain; photosensitivity reaction; injection site inflammation
CAFNet-D,2,635,verteporfin,19,0.14808257598580285,0.7380836707152496,0.2895229882348575,0.2,0.15789473684210525,0.026835016835016837,0.018397557946775164,0.21969714112516747,0.0190315516334257,1.0,nausea; asthenia; body temperature increased; pain; back pain,injection site pain; hypercholesterolaemia; injection site haemorrhage; hyperaesthesia; injection site inflammation
CAFNet-DG,2,635,verteporfin,19,0.15866692924049433,0.7468286099865046,0.2984900352767556,0.26666666666666666,0.21052631578947367,0.0256492256549291,0.017981610214550036,0.2350892266834375,0.021203187217067248,1.0,nausea; asthenia; pain; body temperature increased; back pain,injection site pain; hypercholesterolaemia; injection site haemorrhage; hyperaesthesia; injection site inflammation
CAFNet,2,636,olsalazine,22,0.6119484300936315,0.9484661429105873,0.8611375561264455,0.7333333333333333,0.5,,,0.620199374173201,0.0035211267605633804,1.0,diarrhoea; gastrointestinal pain; abdominal pain; nausea; dermatitis,rectal haemorrhage
CAFNet-D,2,636,olsalazine,22,0.7188427804361863,0.9792368125701458,1.0,0.7333333333333333,0.5,,,0.7198311283346466,0.008264462809917356,1.0,nausea; vomiting; headache; diarrhoea; dizziness,rectal haemorrhage
CAFNet-DG,2,636,olsalazine,22,0.7172279849386592,0.9772259633370745,1.0,0.7333333333333333,0.5,,,0.7188576854743154,0.007246376811594203,1.0,nausea; vomiting; diarrhoea; headache; dermatitis,rectal haemorrhage
CAFNet,2,638,tegaserod,18,0.2782307765652469,0.9456967213114754,0.40408855203223926,0.4,0.3333333333333333,,,0.2800607936241072,0.06271808297037655,1.0,headache; nausea; diarrhoea; flatulence; vomiting,injury; dysmenorrhoea; migraine; osteoarthritis; arthropathy
CAFNet-D,2,638,tegaserod,18,0.47151478082804005,0.9243510928961749,0.6489315753318465,0.4666666666666667,0.3888888888888889,,,0.47882294283893606,0.021165150446931555,1.0,nausea; headache; dizziness; vomiting; diarrhoea,injury; migraine; arthropathy; osteoarthritis; dysmenorrhoea
CAFNet-DG,2,638,tegaserod,18,0.45191383571969024,0.936646174863388,0.6489315753318465,0.4666666666666667,0.3888888888888889,,,0.45651920039177407,0.0430536625465809,1.0,headache; nausea; vomiting; dizziness; diarrhoea,injury; migraine; arthropathy; osteoarthritis; dysmenorrhoea
CAFNet,2,648,rivaroxaban,22,0.1190979223387229,0.7111157875046764,0.0980646175538648,0.26666666666666666,0.18181818181818182,0.0030120481927710845,0.004807692307692308,0.14015232346016165,0.013734501366711342,1.0,dyspepsia; asthenia; fatigue; dizziness; back pain,gastrointestinal haemorrhage; menorrhagia; toothache; osteoarthritis; dermatitis bullous
CAFNet-D,2,648,rivaroxaban,22,0.17060659886206264,0.8436213991769548,0.23690530871965648,0.26666666666666666,0.18181818181818182,0.014084507042253521,0.0037593984962406013,0.1879647067910005,0.023547631205020216,1.0,dizziness; asthenia; fatigue; dyspepsia; pruritus,toothache; menorrhagia; oropharyngeal pain; gastrointestinal haemorrhage; osteoarthritis
CAFNet-DG,2,648,rivaroxaban,22,0.15786584966489284,0.833707444818556,0.22476126319537007,0.26666666666666666,0.18181818181818182,0.01020408163265306,0.003676470588235294,0.1741085590726835,0.022981771147442567,1.0,dizziness; asthenia; fatigue; dyspepsia; back pain,toothache; menorrhagia; gastrointestinal haemorrhage; oropharyngeal pain; osteoarthritis
CAFNet,2,672,vernakalant,16,0.10514615017020698,0.7455904907975459,0.16027990991902227,0.13333333333333333,0.125,0.010099559338973513,0.00921531403258978,0.14382042285664476,0.005020390925568495,0.9333333333333333,nausea; diarrhoea; paraesthesia; cough; dyspnoea,burning sensation; pruritus generalised; sneezing; infusion site pain; eye irritation
CAFNet-D,2,672,vernakalant,16,0.1883933658253529,0.8503323108384457,0.25880978898961277,0.26666666666666666,0.25,0.04834947112772824,0.01544335536813312,0.2573062418085968,0.009735550670041993,1.0,nausea; diarrhoea; dyspnoea; cough; hypotension,sneezing; eye irritation; burning sensation; infusion site pain; pruritus generalised
CAFNet-DG,2,672,vernakalant,16,0.16874430229492024,0.8364647239263804,0.20483424751859086,0.2,0.1875,0.031712804739120526,0.01442577030812325,0.2306231980899929,0.00787117149697049,1.0,nausea; diarrhoea; dyspnoea; cough; paraesthesia,sneezing; eye irritation; burning sensation; pruritus generalised; infusion site pain
CAFNet,2,681,boceprevir,236,0.48409234303304927,0.6503566477348957,1.0,1.0,0.0635593220338983,0.07600262764405202,0.1392664942317624,0.6688793924425772,0.18918509857840315,0.9333333333333333,headache; pain; asthenia; fatigue; constipation,sleep disorder; nasal congestion; blood triglycerides increased; hyperuricaemia; blood uric acid increased
CAFNet-D,2,681,boceprevir,236,0.5668343578437727,0.7424533786503287,1.0,1.0,0.0635593220338983,0.11767017574570156,0.17908327344782238,0.7190321500258445,0.23082144395726614,1.0,headache; nausea; vomiting; diarrhoea; dizziness,influenza like illness; abdominal discomfort; nasal congestion; hypertriglyceridaemia; musculoskeletal pain
CAFNet-DG,2,681,boceprevir,236,0.566311834509644,0.7328496042216358,1.0,1.0,0.0635593220338983,0.10817331686208519,0.19294485623706095,0.7212389403970525,0.23199705257530998,1.0,headache; nausea; diarrhoea; vomiting; asthenia,nasal congestion; sleep disorder; blood triglycerides increased; influenza like illness; abdominal discomfort
CAFNet,2,690,carfilzomib,41,0.25848760417173533,0.7911089499142632,0.4233117951052935,0.4,0.14634146341463414,,0.009888812007456076,0.2980027299333444,0.009347205368797133,0.8,headache; insomnia; pain; asthenia; fatigue,hyponatraemia; cardiac failure congestive; blood creatinine increased; hypophosphataemia; musculoskeletal chest pain
CAFNet-D,2,690,carfilzomib,41,0.5354907863754259,0.9401888772298006,0.793584067764911,0.7333333333333333,0.2682926829268293,,0.08899823087129588,0.580065094465757,0.04315723472386367,1.0,headache; dizziness; nausea; diarrhoea; vomiting,musculoskeletal chest pain; renal failure; blood creatinine increased; hyponatraemia; hypomagnesaemia
CAFNet-DG,2,690,carfilzomib,41,0.49627104738603617,0.9122923758093825,0.8603818544462509,0.7333333333333333,0.2682926829268293,,0.035354042247979,0.5419979151050298,0.025142630742558708,1.0,headache; dizziness; nausea; asthenia; diarrhoea,hyponatraemia; blood creatinine increased; cardiac failure congestive; musculoskeletal chest pain; renal failure
CAFNet,2,693,trametinib,61,0.45791219019407486,0.747360005622617,0.8325041605093579,0.8,0.19672131147540983,0.021255532261821572,0.02059329244845376,0.553738809802183,0.04230106892873,1.0,headache; nausea; abdominal pain; gastrointestinal pain; constipation,blood alkaline phosphatase increased; gamma-glutamyltransferase increased; hyperbilirubinaemia; dermatitis acneiform; lymphopenia
CAFNet-D,2,693,trametinib,61,0.6095351097840577,0.918226064343823,1.0,0.8666666666666667,0.21311475409836064,0.009256354835165296,0.13089338002532447,0.6945234661654262,0.16951738718092765,1.0,nausea; headache; vomiting; diarrhoea; dizziness,blood creatinine increased; hyponatraemia; hyperkalaemia; renal failure; hypocalcaemia
CAFNet-DG,2,693,trametinib,61,0.5803672232922229,0.9105652487129478,1.0,0.8,0.19672131147540983,0.010018463845718605,0.10196739653261394,0.6596014209106479,0.12368837330176824,1.0,headache; nausea; diarrhoea; vomiting; abdominal pain,blood alkaline phosphatase increased; gamma-glutamyltransferase increased; hyponatraemia; hyperbilirubinaemia; renal failure
CAFNet,2,695,ulipristal,9,0.5437471956461337,0.8830795262267344,0.6776279782764284,0.4666666666666667,0.7777777777777778,,,0.5484158990625406,0.0012345679012345679,0.9333333333333333,nausea; abdominal pain; gastrointestinal pain; asthenia; fatigue,dysmenorrhoea
CAFNet-D,2,695,ulipristal,9,0.6210497443548291,0.9821771009588268,0.7104928563593766,0.4666666666666667,0.7777777777777778,,,0.6210497443548291,0.03571428571428571,1.0,headache; nausea; asthenia; dizziness; fatigue,dysmenorrhoea
CAFNet-DG,2,695,ulipristal,9,0.7138946720446133,0.9787930062041738,0.8253470553818276,0.4666666666666667,0.7777777777777778,,,0.7142122533454264,0.02564102564102564,1.0,headache; nausea; asthenia; dizziness; fatigue,dysmenorrhoea
CAFNet,2,703,pegvisomant,42,0.5412792874282318,0.8608943577430972,0.9052116356304493,0.8666666666666667,0.30952380952380953,0.07358895317715858,0.04319510898458267,0.6488409548714777,0.11705306905216542,0.8666666666666667,sinusitis; influenza; rhinitis; pharyngitis; upper respiratory tract infection,hypoglycaemia; injection site reaction; swelling; lipodystrophy acquired; respiratory tract infection
CAFNet-D,2,703,pegvisomant,42,0.4326460800446073,0.8627951180472189,0.6371523797895857,0.5333333333333333,0.19047619047619047,0.031133691935024223,0.06080448845445453,0.5165838291474234,0.05589673825457382,1.0,headache; nausea; vomiting; diarrhoea; asthenia,hypoglycaemia; injection site reaction; swelling; respiratory tract infection; lipodystrophy acquired
