CAFNet-DG,7,246,methylphenidate,109,0.5816877322536075,0.8445653864095787,1.0,0.9333333333333333,0.12844036697247707,0.010689157902855205,0.07003989644321304,0.6740264371405388,0.19629229700281844,1.0,dizziness; headache; nausea; diarrhoea; vomiting,arrhythmia; angina pectoris; abdominal discomfort; mediastinal disorder; libido decreased
CAFNet,7,274,nateglinide,24,0.41340849474681246,0.9185137457044673,0.624232247406789,0.5333333333333333,0.3333333333333333,,,0.41864316846863275,0.02306128149040252,1.0,nausea; vomiting; fatigue; cough; dyspepsia,injury; hypoglycaemia; osteoarthritis; thirst; arthropathy
CAFNet-D,7,274,nateglinide,24,0.5772541978383492,0.9631872852233677,0.7975167679274938,0.8,0.5,,,0.5841423364322157,0.23954145536051782,1.0,nausea; dizziness; vomiting; diarrhoea; asthenia,hypoglycaemia; injury; arthropathy; thirst; osteoarthritis
CAFNet-DG,7,274,nateglinide,24,0.5424908675704858,0.9558848797250858,0.7312625444731049,0.7333333333333333,0.4583333333333333,,,0.54612162849199,0.05670831070802182,1.0,nausea; vomiting; dizziness; diarrhoea; asthenia,hypoglycaemia; injury; osteoarthritis; arthropathy; thirst
CAFNet,7,281,nisoldipine,11,0.4383748099921892,0.97077591787663,0.46081298306235335,0.4,0.5454545454545454,,0.02,0.47781229099140804,0.006097560975609756,1.0,dizziness; headache; chest pain; palpitations; oedema peripheral,vasodilation procedure
CAFNet-D,7,281,nisoldipine,11,0.4446130881289295,0.9766947193193378,0.4690000933206748,0.3333333333333333,0.45454545454545453,,1.0,0.47839478529133694,0.037037037037037035,1.0,headache; dizziness; nausea; dermatitis; rash,vasodilation procedure
CAFNet-DG,7,281,nisoldipine,11,0.4932153547210366,0.980948857856284,0.4537425745411855,0.4,0.5454545454545454,,0.2,0.5339431401931402,0.020833333333333332,1.0,headache; dizziness; nausea; palpitations; dermatitis,vasodilation procedure
CAFNet,7,286,repaglinide,7,0.12611245696799694,0.9467361412650166,0.11838279295536289,0.06666666666666667,0.14285714285714285,,,0.12805393905714105,0.17328918322295805,1.0,diarrhoea; bronchitis; rhinitis; back pain; urinary tract infection,angina pectoris; hypoglycaemia
CAFNet-D,7,286,repaglinide,7,0.12242195327743499,0.9641047908525112,0.11838279295536289,0.06666666666666667,0.14285714285714285,,,0.12258018112553627,0.20192307692307693,1.0,diarrhoea; back pain; urinary tract infection; rhinitis; bronchitis,hypoglycaemia; angina pectoris
CAFNet-DG,7,286,repaglinide,7,0.13538187279968888,0.9694601244753221,0.11838279295536289,0.06666666666666667,0.14285714285714285,,,0.13538187279968888,0.34090909090909094,1.0,diarrhoea; back pain; rhinitis; bronchitis; urinary tract infection,angina pectoris; hypoglycaemia
CAFNet,7,295,oxycodone,10,0.5548686833126192,0.99369918699187,0.5509662124799076,0.4666666666666667,0.7,,,0.5548686833126193,,1.0,nausea; asthenia; dizziness; somnolence; vomiting,
CAFNet-D,7,295,oxycodone,10,0.5778650516150516,0.9939024390243902,0.49545888247018083,0.5333333333333333,0.8,,,0.5778650516150515,,1.0,nausea; dizziness; vomiting; asthenia; somnolence,
CAFNet-DG,7,295,oxycodone,10,0.5856481481481481,0.9946138211382113,0.5645252544249326,0.4666666666666667,0.7,,,0.5856481481481481,,1.0,nausea; dizziness; vomiting; asthenia; somnolence,
CAFNet,7,299,paroxetine,408,0.6714866027372317,0.7099854446898214,1.0,1.0,0.03676470588235294,0.15675117836074592,0.42007364713344036,0.8373153591266566,0.4959218223631092,1.0,insomnia; decreased appetite; nausea; headache; asthenia,eye disorder; atrial fibrillation; diabetes mellitus; ecchymosis; cholelithiasis
CAFNet-D,7,299,paroxetine,408,0.722603971809781,0.766475105400522,1.0,1.0,0.03676470588235294,0.17909399921033978,0.3778926641423732,0.8586206894907085,0.5456655649542768,1.0,headache; nausea; dizziness; vomiting; diarrhoea,angiopathy; injury; increased appetite; cardiac disorder; arthritis
CAFNet-DG,7,299,paroxetine,408,0.7307483524190698,0.771527638359098,1.0,1.0,0.03676470588235294,0.18908461319559064,0.4202335604485328,0.8568525860751935,0.5622740684292736,1.0,headache; nausea; dizziness; diarrhoea; asthenia,eye disorder; increased appetite; abnormal dreams; cardiac disorder; gastroenteritis
CAFNet,7,301,penciclovir,15,0.3733469182450953,0.9510384746339804,0.4288398090337664,0.4,0.4,,0.015384615384615385,0.4001616110988554,0.021870796323012785,1.0,pruritus; diarrhoea; headache; vomiting; fatigue,dysmenorrhoea; migraine; application site reaction
CAFNet-D,7,301,penciclovir,15,0.39461451829103866,0.9252298263534219,0.4883491838252097,0.4666666666666667,0.4666666666666667,,0.015625,0.42300472741266165,0.008336503736693552,1.0,headache; vomiting; diarrhoea; asthenia; fatigue,application site reaction; dysmenorrhoea; migraine
CAFNet-DG,7,301,penciclovir,15,0.3983232592080802,0.9368743615934627,0.5469356251448461,0.4666666666666667,0.4666666666666667,,0.01694915254237288,0.4262331375314252,0.010393555058196795,1.0,headache; vomiting; diarrhoea; asthenia; pruritus,dysmenorrhoea; application site reaction; migraine
CAFNet,7,313,podophyllotoxin,7,0.10545993669567348,0.9008539586047184,0.09791292534996787,0.2,0.42857142857142855,,0.009174311926605505,0.1217533033322507,0.0027624309392265192,1.0,pain; headache; pruritus; erythema; haemoglobin,inflammation
CAFNet-D,7,313,podophyllotoxin,7,0.1149256933486793,0.9229989868287741,0.13743816645714546,0.06666666666666667,0.14285714285714285,,0.04,0.12915076089935074,0.01,1.0,headache; pain; pruritus; haemoglobin; haemorrhage,inflammation
CAFNet-DG,7,313,podophyllotoxin,7,0.1165847016035539,0.9316833116225212,0.11838279295536289,0.13333333333333333,0.2857142857142857,,0.034482758620689655,0.13099747474747475,0.008695652173913044,1.0,headache; pain; pruritus; haemoglobin; haemorrhage,inflammation
CAFNet,7,342,sildenafil,59,0.5942780232547188,0.9107586331913351,0.8364586133797036,0.6666666666666666,0.1694915254237288,0.0038910505836575876,0.005050505050505051,0.6310942032146972,0.19139238404586711,1.0,nausea; vomiting; headache; diarrhoea; fatigue,gastritis; myocardial infarction; acute coronary syndrome; cerebrovascular accident; nasal congestion
CAFNet-D,7,342,sildenafil,59,0.6581859270212527,0.9419922052025742,0.9363792118010483,0.6666666666666666,0.1694915254237288,0.002793296089385475,0.004784688995215311,0.6841887795131532,0.07311314298209602,1.0,nausea; headache; dizziness; vomiting; diarrhoea,atrial fibrillation; nasal congestion; gastritis; rhinorrhoea; myocardial infarction
CAFNet-DG,7,342,sildenafil,59,0.6799958848798417,0.9452732710958034,0.9363792118010483,0.6666666666666666,0.1694915254237288,0.0028011204481792717,0.0047169811320754715,0.7059116453759308,0.10551035897595619,1.0,nausea; vomiting; headache; diarrhoea; asthenia,gastritis; nasal congestion; myocardial infarction; acute coronary syndrome; atrial fibrillation
CAFNet,7,347,streptomycin,5,0.12540898862737943,0.8232558139534883,0.27167749775971956,0.13333333333333333,0.4,0.005434782608695652,,0.1561647173489279,0.009105112871073757,1.0,nausea; vomiting; vertigo; deafness; ototoxicity,deafness; ototoxicity
CAFNet-D,7,347,streptomycin,5,0.24952587223008016,0.8774519716885744,0.38356636737133554,0.13333333333333333,0.4,0.016666666666666666,,0.3096354166666666,0.008791756052712228,1.0,nausea; vomiting; vertigo; deafness; ototoxicity,deafness; ototoxicity
CAFNet-DG,7,347,streptomycin,5,0.3496059229018331,0.8754297269969666,0.5087403079104241,0.13333333333333333,0.4,0.014705882352941176,,0.43487961809879616,0.009977827050997784,1.0,nausea; vomiting; vertigo; deafness; ototoxicity,deafness; ototoxicity
CAFNet,7,363,thiotepa,17,0.39646841039776515,0.8535131555180925,0.5077181160122074,0.4,0.35294117647058826,,0.02564102564102564,0.4284046503634019,0.004212907099429317,0.9333333333333333,urticaria; vomiting; pruritus; hypersensitivity; body temperature increased,skin hyperpigmentation; urinary retention; amenorrhoea
CAFNet-D,7,363,thiotepa,17,0.4901392877224632,0.9326870973568547,0.7015099647232445,0.6,0.5294117647058824,,0.013888888888888888,0.5203889197956919,0.0097533894343151,1.0,dizziness; vomiting; headache; dermatitis; rash,urinary retention; skin hyperpigmentation; amenorrhoea
CAFNet-DG,7,363,thiotepa,17,0.5184880585158405,0.9264254319947016,0.6036081270984908,0.7333333333333333,0.6470588235294118,,0.023255813953488372,0.5499087670625151,0.007721165234336256,1.0,vomiting; dermatitis; rash; pruritus; headache,skin hyperpigmentation; urinary retention; amenorrhoea
CAFNet,7,377,tranexamic.acid,19,0.11805694935935812,0.7893657219973009,0.08514311764162101,0.13333333333333333,0.10526315789473684,,0.006946935456871608,0.13548945159971346,0.021140800962390734,1.0,headache; fatigue; asthenia; abdominal pain; gastrointestinal pain,musculoskeletal pain; migraine; angiopathy; pulmonary embolism; cerebrovascular accident
CAFNet-D,7,377,tranexamic.acid,19,0.16182927822826418,0.8419433198380567,0.25206494032666715,0.2,0.15789473684210525,,0.01776287630189756,0.17888811916542496,0.021856415629192792,1.0,headache; asthenia; fatigue; abdominal pain; gastrointestinal pain,migraine; musculoskeletal pain; cerebrovascular accident; respiratory failure; nervous system disorder
CAFNet-DG,7,377,tranexamic.acid,19,0.17014702803158885,0.8371390013495277,0.28351493630661884,0.2,0.15789473684210525,,0.010914760914760915,0.18905773415272864,0.023031116368278277,1.0,headache; asthenia; fatigue; abdominal pain; gastrointestinal pain,migraine; musculoskeletal pain; cerebrovascular accident; angiopathy; pulmonary embolism
CAFNet,7,393,venlafaxine,400,0.5963416347262477,0.6659764309764309,1.0,1.0,0.0375,0.18355743599693128,0.32918168709553847,0.812385955037888,0.43879626981218034,1.0,dry mouth; nausea; headache; dizziness; vomiting,proteinuria; protein urine present; yawning; orgasm abnormal; irritability
CAFNet-D,7,393,venlafaxine,400,0.6838757841339356,0.7438552188552189,1.0,1.0,0.0375,0.3189584988809197,0.3508376897266093,0.8130077431441194,0.5410373806912776,1.0,nausea; dizziness; headache; vomiting; diarrhoea,increased appetite; arthritis; arthropathy; salivary hypersecretion; osteoarthritis
CAFNet-DG,7,393,venlafaxine,400,0.6633371795107535,0.7274621212121213,1.0,1.0,0.0375,0.22024360045496824,0.3493380724450272,0.8182756620147418,0.5110336334636701,1.0,nausea; headache; dizziness; vomiting; diarrhoea,migraine; libido decreased; urine output increased; dysphagia; thirst
CAFNet,7,395,vinorelbine,53,0.4075288740431434,0.8634130691957572,0.7967610662472993,0.6666666666666666,0.18867924528301888,0.02011636731596256,0.08894532379062083,0.4896617989627879,0.05131356376093537,0.8,diarrhoea; anaemia; nausea; vomiting; body temperature increased,febrile neutropenia; phlebitis; dysphagia; thrombosis; transaminases increased
CAFNet-D,7,395,vinorelbine,53,0.5436889057608189,0.884506646883083,1.0,0.8666666666666667,0.24528301886792453,0.029353520096858106,0.04533486725483203,0.6495152592592234,0.10904740367162885,1.0,nausea; diarrhoea; vomiting; headache; dizziness,febrile neutropenia; agranulocytosis; blood bilirubin increased; injection site reaction; injection site pain
CAFNet-DG,7,395,vinorelbine,53,0.5149604109842503,0.8846269524592465,1.0,0.8666666666666667,0.24528301886792453,0.02891759540695711,0.05193748067788989,0.6135825359134831,0.07109425097544322,1.0,nausea; diarrhoea; vomiting; headache; asthenia,febrile neutropenia; phlebitis; transaminases increased; dysphagia; blood bilirubin increased
CAFNet,7,402,zonisamide,165,0.508365548862576,0.7569177906934239,1.0,1.0,0.09090909090909091,0.011710662525879916,0.07312777389735103,0.6530848075363584,0.15043708595474575,1.0,headache; nausea; diarrhoea; dizziness; dyspepsia,injury; thirst; urinary retention; dysuria; gastritis
CAFNet-D,7,402,zonisamide,165,0.6447722594511884,0.8917790693423986,1.0,1.0,0.09090909090909091,0.1607142857142857,0.18537679023241144,0.7039898919606368,0.31084336053501926,1.0,nausea; headache; dizziness; vomiting; diarrhoea,injury; ataxia; arthritis; osteoarthritis; urinary incontinence
CAFNet-DG,7,402,zonisamide,165,0.626876902335316,0.8857696384837518,1.0,1.0,0.09090909090909091,0.14545454545454545,0.14901710722452702,0.6890263396163809,0.28849070738970384,1.0,headache; nausea; dizziness; diarrhoea; vomiting,injury; thirst; dysuria; gastritis; urinary retention
CAFNet,7,404,oxytocin,9,0.035709292785484716,0.7798082346305696,0.0,0.0,0.0,,0.0045871559633027525,0.05304239385175924,0.0037157814594969713,0.4666666666666667,nausea; vomiting; dermatitis; rash; dyspnoea,anaphylactic shock; anaphylactoid reaction
CAFNet-D,7,404,oxytocin,9,0.1792764115927972,0.8796390298928369,0.20845080532622157,0.2,0.3333333333333333,,0.006134969325153374,0.20099832952115657,0.004041856572993086,1.0,nausea; vomiting; dermatitis; rash; dyspnoea,anaphylactic shock; anaphylactoid reaction
CAFNet-DG,7,404,oxytocin,9,0.1252598526905878,0.8556119571347998,0.20124768870643622,0.13333333333333333,0.2222222222222222,,0.0058823529411764705,0.14512156163489953,0.0040653093601269175,0.9333333333333333,nausea; vomiting; dermatitis; rash; dyspnoea,anaphylactic shock; anaphylactoid reaction
CAFNet,7,416,amiloride,5,0.26522702104097456,0.9332659251769464,0.41774584760242595,0.2,0.6,,,0.26675913083680075,0.0047169811320754715,0.9333333333333333,vomiting; diarrhoea; headache; decreased appetite; hyperkalaemia,hyperkalaemia
CAFNet-D,7,416,amiloride,5,0.43401534526854224,0.9419615773508595,0.529634717214042,0.2,0.6,,,0.4346840023563072,0.0056179775280898875,1.0,headache; vomiting; diarrhoea; decreased appetite; hyperkalaemia,hyperkalaemia
CAFNet-DG,7,416,amiloride,5,0.42921218139688844,0.9437815975733064,0.529634717214042,0.2,0.6,,,0.4299431009957326,0.005917159763313609,1.0,vomiting; headache; diarrhoea; decreased appetite; hyperkalaemia,hyperkalaemia
CAFNet,7,417,pimozide,28,0.3579278707734801,0.9009908311150547,0.6025064803817581,0.4666666666666667,0.25,0.3650615901455767,0.07150900900900901,0.4181548277248872,0.12151168800453838,1.0,somnolence; dry mouth; headache; diarrhoea; asthenia,salivary hypersecretion; abnormal dreams; dysphagia; increased appetite; speech disorder
CAFNet-D,7,417,pimozide,28,0.2949457996481257,0.8173617272996155,0.6156886473955917,0.4666666666666667,0.25,0.009019603867379043,0.05964912280701754,0.35090242769203595,0.028797197686955815,1.0,headache; dizziness; diarrhoea; asthenia; dermatitis,dysphagia; electrocardiogram abnormal; increased appetite; abnormal dreams; muscle rigidity
CAFNet-DG,7,417,pimozide,28,0.3278079384781568,0.8488612836438924,0.5964984284535196,0.5333333333333333,0.2857142857142857,0.013024075799503263,0.08204334365325078,0.3868453290474124,0.05263459073579746,1.0,headache; diarrhoea; dizziness; asthenia; dermatitis,dysphagia; abnormal dreams; increased appetite; salivary hypersecretion; muscle rigidity
CAFNet,7,426,conjugated.estrogens,17,0.08019894890170925,0.7382744295261605,0.1100458831490401,0.2,0.17647058823529413,,0.040064897947063555,0.101140176987293,0.026455117169544882,1.0,headache; dizziness; pain; pruritus; muscle spasms,vaginal infection; vulvovaginal mycotic infection; vulvovaginal candidiasis; vaginal haemorrhage; breast pain
CAFNet-D,7,426,conjugated.estrogens,17,0.1574734667730167,0.8286471190318502,0.3301376494471203,0.13333333333333333,0.11764705882352941,,0.09263766430871068,0.1933791013730945,0.051179391629911655,1.0,headache; dizziness; pruritus; pain; muscle spasms,migraine; vasodilation procedure; breast pain; vaginal infection; dysuria
CAFNet-DG,7,426,conjugated.estrogens,17,0.15492096535495126,0.8294298272021192,0.3301376494471203,0.13333333333333333,0.11764705882352941,,0.07392057176539935,0.19029149037375848,0.049328060801563094,1.0,headache; dizziness; pain; pruritus; muscle spasms,vaginal infection; migraine; breast pain; vasodilation procedure; vaginal haemorrhage
CAFNet,7,434,pinaverium,8,0.5092910036354967,0.9735040567951319,0.6678144472275096,0.3333333333333333,0.625,,0.1111111111111111,0.5721088435374149,0.029411764705882353,1.0,diarrhoea; nausea; headache; dyspepsia; constipation,dermatitis atopic
CAFNet-D,7,434,pinaverium,8,0.4886989312770562,0.9579107505070994,0.6057825067661952,0.3333333333333333,0.625,,0.05555555555555555,0.5533182591218305,0.008264462809917356,1.0,headache; nausea; diarrhoea; constipation; dyspepsia,dermatitis atopic
CAFNet-DG,7,434,pinaverium,8,0.5440978433710992,0.9676724137931034,0.6949410105562137,0.3333333333333333,0.625,,0.125,0.6146832495669705,0.015151515151515152,1.0,headache; nausea; diarrhoea; constipation; dyspepsia,dermatitis atopic
CAFNet,7,451,octreotide,26,0.28604708975235993,0.8337968849332485,0.5067837010870874,0.3333333333333333,0.19230769230769232,0.0074849480021893814,0.2071026722925457,0.34391402711160435,0.14518078390536895,0.9333333333333333,headache; diarrhoea; pain; dizziness; bradycardia,cholelithiasis; hypoglycaemia; abdominal distension; cholecystitis; transaminases increased
CAFNet-D,7,451,octreotide,26,0.30378359891533024,0.882350603941513,0.510069131458292,0.4,0.23076923076923078,0.012230989956958392,0.06825662260444869,0.3613484937843546,0.07090912022619184,1.0,headache; diarrhoea; dizziness; vomiting; dyspepsia,hypoglycaemia; abdominal distension; cholelithiasis; hyperbilirubinaemia; transaminases increased
CAFNet-DG,7,451,octreotide,26,0.29718551392062936,0.8883900190718372,0.4886446891881014,0.3333333333333333,0.19230769230769232,0.0116820958498646,0.12770345596432553,0.3451608678554792,0.17815007848410547,1.0,headache; diarrhoea; dizziness; vomiting; dyspepsia,hypoglycaemia; abdominal distension; cholelithiasis; transaminases increased; hyperbilirubinaemia
CAFNet,7,461,rotigotine,37,0.32019068518347776,0.8915812364088226,0.44173955623824734,0.4666666666666667,0.1891891891891892,,0.07309941520467836,0.34363740601833753,0.1064883054308376,0.8666666666666667,somnolence; nausea; fatigue; tremor; asthenia,lethargy; dyskinesia; abnormal dreams; hallucination; musculoskeletal pain
CAFNet-D,7,461,rotigotine,37,0.43692148796906843,0.8893219238046824,0.866947989864271,0.6666666666666666,0.2702702702702703,,0.019984700707592274,0.4604206444932566,0.07889710389420528,1.0,dizziness; nausea; headache; diarrhoea; vomiting,hallucination; dyskinesia; abnormal dreams; lethargy; menopausal symptoms
CAFNet-DG,7,461,rotigotine,37,0.4589319484333959,0.8969471038436555,0.9305687780632227,0.7333333333333333,0.2972972972972973,,0.03896103896103896,0.48306520281733184,0.09036390522689411,1.0,nausea; dizziness; headache; diarrhoea; vomiting,hallucination; dyskinesia; lethargy; abnormal dreams; hiccups
CAFNet,7,482,olopatadine,17,0.27835888474858156,0.9536998013125415,0.27426546945536817,0.26666666666666666,0.23529411764705882,0.01282051282051282,1.0,0.2921750013410934,0.14800316330565438,1.0,headache; cough; fatigue; body temperature increased; asthenia,throat irritation; laryngeal pain; upper-airway cough syndrome
CAFNet-D,7,482,olopatadine,17,0.3156490344152162,0.953037509783852,0.423676645087319,0.3333333333333333,0.29411764705882354,0.034482758620689655,0.1,0.3473246730869626,0.06514605842336935,1.0,headache; asthenia; fatigue; dermatitis; rash,laryngeal pain; throat irritation; upper-airway cough syndrome
CAFNet-DG,7,482,olopatadine,17,0.32499949271378237,0.9587573002588957,0.3600558568883673,0.4,0.35294117647058826,0.034482758620689655,1.0,0.34895439826812374,0.12623828647925034,1.0,headache; asthenia; fatigue; dermatitis; rash,throat irritation; laryngeal pain; upper-airway cough syndrome
CAFNet,7,495,colestilan,47,0.4862199863782437,0.8128917746972522,0.9305687780632227,0.7333333333333333,0.23404255319148937,0.03181277056277056,0.016943102495587024,0.598252934153449,0.11421041960034897,1.0,nausea; diarrhoea; headache; vomiting; gastrointestinal pain,musculoskeletal pain; gastrointestinal haemorrhage; dysphagia; hypocalcaemia; polydipsia
CAFNet-D,7,495,colestilan,47,0.5363949212025231,0.8794850479678268,0.9266360779006398,0.8666666666666667,0.2765957446808511,0.021793409734307708,0.06983288230546456,0.6392589431888538,0.1757614842363052,1.0,nausea; headache; vomiting; diarrhoea; dizziness,abdominal discomfort; abdominal distension; musculoskeletal pain; hepatic enzyme increased; gastritis
CAFNet-DG,7,495,colestilan,47,0.5382434751028792,0.879058168010964,0.9266360779006398,0.9333333333333333,0.2978723404255319,0.02460227777436129,0.05240792489244501,0.642943067715508,0.1515372153045063,1.0,nausea; diarrhoea; headache; vomiting; asthenia,musculoskeletal pain; abdominal distension; abdominal discomfort; gastrointestinal haemorrhage; hypocalcaemia
CAFNet,7,506,iloperidone,28,0.17151608146066957,0.8384353741496599,0.23680742154717782,0.26666666666666666,0.14285714285714285,0.019564414913252122,0.0051813471502590676,0.2072533254187198,0.018987855239528232,0.9333333333333333,nausea; diarrhoea; dry mouth; dermatitis; rash,nasal congestion; musculoskeletal stiffness; abdominal discomfort; lethargy; ejaculation failure
CAFNet-D,7,506,iloperidone,28,0.4243405135834914,0.9253179532682638,0.7257345305446319,0.6,0.32142857142857145,0.04635258358662614,0.08333333333333333,0.4652211460994518,0.058514073844812164,1.0,nausea; dizziness; diarrhoea; asthenia; fatigue,abdominal discomfort; nasal congestion; parkinsonism; musculoskeletal stiffness; extrapyramidal disorder
CAFNet-DG,7,506,iloperidone,28,0.3646542012770488,0.912488908606921,0.6332971816211658,0.5333333333333333,0.2857142857142857,0.044407894736842105,0.024390243902439025,0.4021153243654774,0.04171692999380545,1.0,nausea; diarrhoea; dizziness; asthenia; dermatitis,nasal congestion; abdominal discomfort; musculoskeletal stiffness; lethargy; parkinsonism
CAFNet,7,510,bleomycin,5,0.053602463174140934,0.8198179979777552,0.1130534017578721,0.06666666666666667,0.2,,0.005319148936170213,0.0652651696129957,0.031156965403962632,1.0,body temperature increased; pneumonia; stomatitis; mucosal inflammation; pulmonary fibrosis,mucosal inflammation; pulmonary fibrosis
CAFNet-D,7,510,bleomycin,5,0.03637606375489286,0.8220424671385238,0.0,0.06666666666666667,0.2,,0.0055248618784530384,0.04366038045934508,0.015069940625943443,1.0,body temperature increased; pneumonia; stomatitis; mucosal inflammation; pulmonary fibrosis,mucosal inflammation; pulmonary fibrosis
CAFNet-DG,7,510,bleomycin,5,0.04496456111219287,0.8256825075834175,0.09803928583135697,0.06666666666666667,0.2,,0.005291005291005291,0.054252576390241086,0.05185185185185186,1.0,body temperature increased; pneumonia; stomatitis; mucosal inflammation; pulmonary fibrosis,mucosal inflammation; pulmonary fibrosis
CAFNet,7,511,gemifloxacin,31,0.26497407397580003,0.6772183700130641,0.6975961695061491,0.4666666666666667,0.22580645161290322,0.009554329407777683,0.05147326681752284,0.3957814508606468,0.027934465264676425,0.8666666666666667,nausea; diarrhoea; headache; vomiting; gastrointestinal pain,blood creatine phosphokinase increased; hyponatraemia; thrombocytosis; blood lactate dehydrogenase increased; blood urea increased
CAFNet-D,7,511,gemifloxacin,31,0.3757894375428761,0.6976853247579807,0.8630152897016883,0.6666666666666666,0.3225806451612903,0.010027502089299586,0.025605544246236314,0.5736476783551445,0.018999939940732787,1.0,nausea; headache; vomiting; diarrhoea; dermatitis,thrombocytosis; blood alkaline phosphatase increased; blood creatine phosphokinase increased; hyponatraemia; blood urea increased
CAFNet-DG,7,511,gemifloxacin,31,0.37387690481644514,0.6999966502529059,0.8701249883466594,0.6,0.2903225806451613,0.009624340926448104,0.026994699261792224,0.5688174459360533,0.020114456506517716,1.0,nausea; headache; vomiting; diarrhoea; abdominal pain,thrombocytosis; blood creatine phosphokinase increased; hyponatraemia; blood alkaline phosphatase increased; blood urea increased
CAFNet,7,523,nelarabine,72,0.5341316088149001,0.8666998071824537,0.8572048559638626,0.7333333333333333,0.1527777777777778,0.026281192301311575,0.08284665678716366,0.6431390811450777,0.0653092735878074,1.0,diarrhoea; nausea; asthenia; chest pain; fatigue,wheezing; pleural effusion; febrile neutropenia; muscular weakness; neuritis
CAFNet-D,7,523,nelarabine,72,0.5482349445396687,0.8869456495541094,0.8643145546088338,0.8666666666666667,0.18055555555555555,0.05063367574917017,0.10254575899458745,0.6495986067588304,0.07373007250425798,1.0,nausea; headache; vomiting; dizziness; diarrhoea,wheezing; transaminases increased; sensory loss; abdominal distension; muscular weakness
CAFNet-DG,7,523,nelarabine,72,0.5615472132252847,0.8924439624005784,1.0,0.8666666666666667,0.18055555555555555,0.04800389682490811,0.09086994737126045,0.6658346697261699,0.07445819705813539,1.0,nausea; diarrhoea; vomiting; headache; asthenia,wheezing; transaminases increased; sensory loss; febrile neutropenia; muscular weakness
CAFNet,7,531,vardenafil,12,0.29266761800422,0.9545145960624576,0.4035015715464804,0.2,0.25,,0.022222222222222223,0.3148323982799004,0.06523905723905724,1.0,nausea; headache; dyspepsia; dizziness; rhinitis,injury; nasal congestion; blood creatine phosphokinase increased
CAFNet-D,7,531,vardenafil,12,0.3667158672555458,0.9435675492192804,0.4690000933206748,0.2,0.25,,0.01694915254237288,0.3974323946245988,0.10911221395092362,1.0,nausea; headache; dizziness; dyspepsia; back pain,injury; nasal congestion; blood creatine phosphokinase increased
CAFNet-DG,7,531,vardenafil,12,0.34138797046242,0.9518839103869654,0.4373524791503101,0.26666666666666666,0.3333333333333333,,0.02631578947368421,0.3689314418831649,0.11122994652406418,1.0,nausea; headache; dizziness; dyspepsia; back pain,injury; nasal congestion; blood creatine phosphokinase increased
CAFNet,7,535,nitisinone,13,0.02422293750829761,0.6813298831647455,0.0,0.0,0.0,0.017857142857142856,0.012724498994521877,0.02901570534262227,0.018408627684089136,0.8666666666666667,pruritus; thrombocytopenia; leukopenia; conjunctivitis; dermatitis exfoliative,dermatitis exfoliative; eye pain; leukocytosis; photophobia; keratitis
