CAFNet,5,125,cyproterone,7,0.011924343694554158,0.5757707338254451,0.0,0.0,0.0,0.0029154518950437317,0.02104247104247104,0.01753015636290127,0.011008505832354227,0.8666666666666667,oedema; gynaecomastia; hepatic function abnormal; myocardial infarction; embolism,gynaecomastia; hepatic function abnormal; myocardial infarction; embolism; acute coronary syndrome
CAFNet-D,5,125,cyproterone,7,0.016239046653573203,0.6888116948907222,0.0,0.0,0.0,0.0031446540880503146,0.03315363881401617,0.018324389126627934,0.016619047813187134,1.0,oedema; gynaecomastia; hepatic function abnormal; myocardial infarction; acute coronary syndrome,gynaecomastia; hepatic function abnormal; myocardial infarction; acute coronary syndrome; embolism
CAFNet-DG,5,125,cyproterone,7,0.016717663935741683,0.6854827037197856,0.0,0.0,0.0,0.0029940119760479044,0.03807471264367816,0.019278031571541124,0.01646768179174401,0.9333333333333333,oedema; gynaecomastia; hepatic function abnormal; myocardial infarction; acute coronary syndrome,gynaecomastia; hepatic function abnormal; myocardial infarction; acute coronary syndrome; embolism
CAFNet,5,129,daunorubicin,43,0.543300693275791,0.8838921086738561,0.914856882358379,0.6,0.20930232558139536,0.009820031298904538,0.0051374716553287975,0.601959209532817,0.009327782914517182,1.0,asthenia; diarrhoea; nausea; neutropenia; constipation,arrhythmia; opportunistic infection; influenza like illness; rectal tenesmus; proctalgia
CAFNet-D,5,129,daunorubicin,43,0.6622670880941428,0.9476193969628054,0.8572048559638626,0.8666666666666667,0.3023255813953488,0.024961240310077522,0.01752136752136752,0.7237110121753269,0.03305315043580198,1.0,nausea; vomiting; headache; diarrhoea; dizziness,influenza like illness; arrhythmia; proctalgia; rectal tenesmus; anorectal discomfort
CAFNet-DG,5,129,daunorubicin,43,0.6199392806457464,0.9425084977869074,0.8572048559638626,0.8666666666666667,0.3023255813953488,0.022557269752220666,0.013682909604519775,0.6776617649879038,0.01983904627603711,1.0,nausea; diarrhoea; headache; vomiting; asthenia,arrhythmia; influenza like illness; proctalgia; rectal tenesmus; opportunistic infection
CAFNet,5,137,didanosine,8,0.36950993344995164,0.9660243407707911,0.4125317798925535,0.13333333333333333,0.25,,,0.3724026127145822,0.011764705882352941,1.0,neuropathy peripheral; diarrhoea; abdominal pain; gastrointestinal pain; rash,pancreatitis
CAFNet-D,5,137,didanosine,8,0.29370811806742775,0.960446247464503,0.34616210387999974,0.4,0.75,,,0.29457452269952267,0.007194244604316547,1.0,diarrhoea; rash; dermatitis; abdominal pain; gastrointestinal pain,pancreatitis
CAFNet-DG,5,137,didanosine,8,0.3048359479503548,0.9719827586206896,0.2793827283901867,0.4,0.75,,,0.3059889515246658,0.011235955056179775,1.0,diarrhoea; neuropathy peripheral; rash; dermatitis; abdominal pain,pancreatitis
CAFNet,5,146,donepezil,268,0.6217352956105504,0.7484478434274906,0.9363792118010483,0.9333333333333333,0.05223880597014925,0.07270818961785167,0.22046946808375148,0.7963861176302263,0.38265716422353724,1.0,somnolence; insomnia; fatigue; dizziness; headache,abdominal distension; hypertonia; increased appetite; electrocardiogram abnormal; cerebrovascular accident
CAFNet-D,5,146,donepezil,268,0.6008892905966984,0.7316208215122734,1.0,1.0,0.055970149253731345,0.09185311987602918,0.15816427694289956,0.7720090629845826,0.2871491216518505,1.0,dizziness; headache; nausea; vomiting; asthenia,oropharyngeal pain; abnormal dreams; hallucination; atrial fibrillation; electrocardiogram abnormal
CAFNet-DG,5,146,donepezil,268,0.6195280866655595,0.7455439743431602,1.0,1.0,0.055970149253731345,0.09897841684725464,0.17483144581324456,0.7853350695323161,0.3244712766093704,1.0,dizziness; headache; nausea; asthenia; fatigue,abdominal distension; increased appetite; electrocardiogram abnormal; hallucination; cerebrovascular accident
CAFNet,5,159,fenofibrate,55,0.40646114285879464,0.6699874140768709,0.914856882358379,0.9333333333333333,0.2545454545454545,0.004166666666666667,0.022558795758953618,0.5129924387651451,0.05534192223855865,0.9333333333333333,headache; diarrhoea; nausea; vomiting; abdominal pain,blood creatinine increased; gastritis; liver function test abnormal; nervous system disorder; pancreatitis
CAFNet-D,5,159,fenofibrate,55,0.5905063776832573,0.8928841126924194,1.0,0.9333333333333333,0.2545454545454545,0.0045045045045045045,0.03801206814175747,0.6637349439838621,0.0432722340058762,1.0,headache; nausea; dizziness; vomiting; asthenia,nervous system disorder; malnutrition; disturbance in sexual arousal; hepatobiliary disease; libido decreased
CAFNet-DG,5,159,fenofibrate,55,0.5563264792198516,0.88610707716139,1.0,1.0,0.2727272727272727,0.0043859649122807015,0.03528251585524551,0.6275884963338858,0.04941936357633188,1.0,headache; nausea; diarrhoea; vomiting; dizziness,nervous system disorder; malnutrition; gastritis; liver function test abnormal; blood creatinine increased
CAFNet,5,170,fluorouracil,16,0.2059593998486047,0.7346625766871165,0.4373524791503101,0.2,0.1875,,0.021324144137325397,0.30271019239847785,0.022762760639801503,0.8,nausea; headache; vomiting; photosensitivity reaction; somnolence,photosensitivity reaction; nail disorder; ulcer; skin hyperpigmentation; eye irritation
CAFNet-D,5,170,fluorouracil,16,0.28605983327074097,0.8784509202453988,0.4690000933206748,0.26666666666666666,0.25,,0.04921337765020957,0.3958389815968741,0.10376289232048927,1.0,nausea; vomiting; headache; somnolence; hypotension,photosensitivity reaction; eye irritation; ulcer; skin hyperpigmentation; application site reaction
CAFNet-DG,5,170,fluorouracil,16,0.2769823396595396,0.8649667689161554,0.4690000933206748,0.2,0.1875,,0.043412575777294744,0.38321696378434994,0.10141164969275511,1.0,nausea; headache; vomiting; somnolence; photosensitivity reaction,photosensitivity reaction; eye irritation; ulcer; skin hyperpigmentation; nail disorder
CAFNet,5,186,gemfibrozil,21,0.30201062830069764,0.8749082366759654,0.3858930373209064,0.4666666666666667,0.3333333333333333,0.0028011204481792717,,0.319345873656541,0.0086220696021059,1.0,nausea; asthenia; constipation; fatigue; vomiting,gout; atrial fibrillation; eczema; appendicitis
CAFNet-D,5,186,gemfibrozil,21,0.4037954824358192,0.912886017716439,0.5914640815742043,0.6,0.42857142857142855,0.0031746031746031746,,0.4234228841086072,0.019562838866230104,1.0,nausea; vomiting; asthenia; fatigue; constipation,atrial fibrillation; eczema; gout; appendicitis
CAFNet-DG,5,186,gemfibrozil,21,0.4166325354149941,0.9079430333284392,0.67269340399873,0.6666666666666666,0.47619047619047616,0.0029411764705882353,,0.43693844535739945,0.01473248706372276,1.0,nausea; asthenia; vomiting; constipation; fatigue,atrial fibrillation; gout; eczema; appendicitis
CAFNet,5,193,haloperidol,50,0.17723141152408686,0.7170762711864407,0.2876263497141272,0.3333333333333333,0.1,0.020079351897914606,0.036378518428344185,0.22549616898184244,0.03839396290257914,0.9333333333333333,nausea; insomnia; headache; rash; dermatitis,face oedema; photosensitivity reaction; urinary retention; psychotic disorder; hypothermia
CAFNet-D,5,193,haloperidol,50,0.18013767704154465,0.6820762711864408,0.4847119890255186,0.3333333333333333,0.1,0.025171469754196367,0.01956739874459431,0.23767461219714278,0.032542042170155126,1.0,headache; nausea; vomiting; insomnia; dermatitis,urinary retention; liver function test abnormal; photosensitivity reaction; face oedema; bronchospasm
CAFNet-DG,5,193,haloperidol,50,0.1992144633895269,0.6932415254237287,0.5107164012496702,0.4,0.12,0.02498332777542265,0.021620124963578707,0.2599247213171889,0.03371057610350252,1.0,headache; nausea; insomnia; vomiting; dermatitis,urinary retention; photosensitivity reaction; liver function test abnormal; face oedema; gynaecomastia
CAFNet,5,204,imipramine,84,0.28539273128458403,0.7047880690737833,0.7951657524814092,0.7333333333333333,0.13095238095238096,0.0994123944374844,0.060333274313916996,0.38428028762785105,0.07716540422102992,0.9333333333333333,dry mouth; headache; dizziness; nausea; palpitations,arrhythmia; micturition disorder; hot flush; sleep disorder; menopausal symptoms
CAFNet-D,5,204,imipramine,84,0.3847723399519637,0.7818288854003139,0.9305687780632227,0.6666666666666666,0.11904761904761904,0.061228256101370025,0.06680773009282168,0.49458186813324595,0.13694973513557773,1.0,headache; dizziness; nausea; somnolence; vomiting,ataxia; sleep disorder; menopausal symptoms; hot flush; hallucination
CAFNet-DG,5,204,imipramine,84,0.3658520948290443,0.7737964416535845,0.933745776545611,0.7333333333333333,0.13095238095238096,0.062299075772771134,0.06563656434437723,0.4702772401882988,0.11445717779465543,1.0,headache; dizziness; nausea; dry mouth; somnolence,sleep disorder; menopausal symptoms; hot flush; ataxia; arrhythmia
CAFNet,5,225,leflunomide,69,0.41996741545254407,0.8570466118292206,0.7791714369672127,0.6666666666666666,0.14492753623188406,0.0105370872282759,0.08531586181506345,0.5262219966739463,0.18991016576902303,0.7333333333333333,dermatitis; rash; infection; pruritus; asthenia,erythema multiforme; toxic epidermal necrolysis; stevens-johnson syndrome; pancreatitis; sepsis
CAFNet-D,5,225,leflunomide,69,0.44403993172312684,0.8344379161770467,0.933745776545611,0.8,0.17391304347826086,0.00739247311827957,0.04830629896335897,0.531228899929161,0.14384437675793862,1.0,nausea; dizziness; diarrhoea; vomiting; asthenia,nervous system disorder; skin disorder; hypophosphataemia; mediastinal disorder; agranulocytosis
CAFNet-DG,5,225,leflunomide,69,0.4565828137127409,0.8567175871523698,0.9363792118010483,0.7333333333333333,0.15942028985507245,0.007644066816946997,0.07249223021954866,0.5335598891509679,0.16343836331320316,1.0,nausea; dermatitis; rash; asthenia; diarrhoea,hypophosphataemia; jaundice; interstitial lung disease; erythema multiforme; sepsis
CAFNet,5,242,mesalazine,117,0.47475024472631894,0.7532428929236227,1.0,0.9333333333333333,0.11965811965811966,0.03728269709716985,0.08638932146386366,0.6138595764755682,0.1425721476515454,0.9333333333333333,headache; nausea; diarrhoea; rash; dermatitis,abdominal distension; rectal haemorrhage; hypertonia; eosinophilia; liver function test abnormal
CAFNet-D,5,242,mesalazine,117,0.4875718299760175,0.7846095371751016,1.0,1.0,0.1282051282051282,0.04703445846445205,0.05124545877021061,0.6181765980670553,0.08941992953992381,1.0,nausea; headache; vomiting; dizziness; diarrhoea,pancytopenia; vaginal infection; eosinophilia; liver function test abnormal; agranulocytosis
CAFNet-DG,5,242,mesalazine,117,0.5050266594401723,0.7951836583535558,1.0,1.0,0.1282051282051282,0.046495236077382124,0.05220016767430523,0.6326489944835956,0.11244040126990229,1.0,headache; nausea; vomiting; dizziness; diarrhoea,abdominal distension; hypertonia; eosinophilia; liver function test abnormal; acne
CAFNet,5,261,mometasone,23,0.13520952400097516,0.8353557515783817,0.06362078819895167,0.13333333333333333,0.08695652173913043,0.02040816326530612,,0.3089300044456553,0.019045137958748903,0.26666666666666666,musculoskeletal discomfort; myalgia; cough; back pain; body temperature increased,viral infection; musculoskeletal pain; rhinitis allergic; candida infection; dysmenorrhoea
CAFNet-D,5,261,mometasone,23,0.32065333616896674,0.9451036582635561,0.24573132854020638,0.3333333333333333,0.21739130434782608,0.008928571428571428,,0.3363290950415357,0.0637301149025375,1.0,vomiting; abdominal pain; gastrointestinal pain; cough; musculoskeletal discomfort,musculoskeletal pain; candida infection; dysmenorrhoea; viral infection; contusion
CAFNet-DG,5,261,mometasone,23,0.28928142924571915,0.9416110688219227,0.23047380976071702,0.26666666666666666,0.17391304347826086,0.01098901098901099,,0.30893967361397906,0.05881755640926268,1.0,vomiting; musculoskeletal discomfort; cough; abdominal pain; gastrointestinal pain,musculoskeletal pain; viral infection; candida infection; dysmenorrhoea; contusion
CAFNet,5,262,montelukast,15,0.23837240601774337,0.941504937010555,0.14201905717762706,0.26666666666666666,0.26666666666666666,0.0625,,0.25318893581645896,0.07443057233633149,1.0,asthenia; fatigue; headache; dizziness; rash,injury; gastroenteritis; pyuria
CAFNet-D,5,262,montelukast,15,0.36942326161049527,0.9134490977187607,0.5114531979843773,0.4666666666666667,0.4666666666666667,0.002840909090909091,,0.39479207003061506,0.12370911241526773,1.0,headache; asthenia; dizziness; dermatitis; rash,gastroenteritis; injury; pyuria
CAFNet-DG,5,262,montelukast,15,0.39477647865598414,0.9152877085461355,0.5363559634917964,0.4666666666666667,0.4666666666666667,0.00303951367781155,,0.4218337670675138,0.11351073569294018,1.0,headache; asthenia; dizziness; fatigue; dermatitis,injury; gastroenteritis; pyuria
CAFNet,5,284,norfloxacin,10,0.17511856477981433,0.9428861788617887,0.17366667134799177,0.2,0.3,,0.07919254658385093,0.20956160533937548,0.07395440395116097,0.7333333333333333,nausea; headache; asthenia; dizziness; eosinophilia,eosinophilia; blood alkaline phosphatase increased; white blood cell count decreased; platelet count decreased; protein urine present
CAFNet-D,5,284,norfloxacin,10,0.3942389934658531,0.9547764227642277,0.545155778742082,0.3333333333333333,0.5,,0.049107142857142856,0.48019778809179475,0.2859000699422976,1.0,nausea; headache; dizziness; abdominal pain; asthenia,eosinophilia; protein urine present; blood alkaline phosphatase increased; platelet count decreased; white blood cell count decreased
CAFNet-DG,5,284,norfloxacin,10,0.3606505130510756,0.9594512195121951,0.46582309483828654,0.3333333333333333,0.5,,0.06979405034324943,0.4348020996348461,0.1754809286898839,1.0,nausea; headache; dizziness; asthenia; abdominal pain,eosinophilia; blood alkaline phosphatase increased; protein urine present; white blood cell count decreased; platelet count decreased
CAFNet,5,290,ondansetron,44,0.22535094346119394,0.7200717703349282,0.6149518506608848,0.4,0.13636363636363635,0.013866308462347463,0.02111275313747079,0.2862506783704951,0.023874017913127016,0.9333333333333333,headache; diarrhoea; asthenia; fatigue; constipation,angiopathy; dysuria; hiccups; hypoxia; bronchospasm
CAFNet-D,5,290,ondansetron,44,0.28476140181388354,0.8073205741626794,0.636474180103554,0.4666666666666667,0.1590909090909091,0.01841043207856864,0.03177028455947223,0.349364276049862,0.045884777680293164,1.0,headache; dizziness; asthenia; diarrhoea; fatigue,injection site reaction; angiopathy; dysuria; hiccups; arrhythmia
CAFNet-DG,5,290,ondansetron,44,0.2759163295465638,0.7966267942583732,0.6528642754944295,0.4,0.13636363636363635,0.01741412519143878,0.031140971373383435,0.3367125706478975,0.042930380067821426,1.0,headache; dizziness; diarrhoea; asthenia; fatigue,angiopathy; injection site reaction; dysuria; hiccups; arrhythmia
CAFNet,5,293,oxaliplatin,121,0.47821175548724876,0.7669099618490434,0.9305687780632227,0.8666666666666667,0.10743801652892562,0.04804103317965935,0.08693109921923062,0.6264738212943954,0.10366272638199764,0.9333333333333333,nausea; headache; diarrhoea; vomiting; abdominal pain,injection site reaction; lacrimation increased; hyponatraemia; dysuria; visual acuity reduced
CAFNet-D,5,293,oxaliplatin,121,0.5787178194854844,0.8382891709976996,1.0,0.9333333333333333,0.11570247933884298,0.04900902260659735,0.11707550918301812,0.7164705707244462,0.16626866288884867,1.0,nausea; headache; vomiting; dizziness; diarrhoea,hyponatraemia; phlebitis; swelling; anaphylactic shock; injection site reaction
CAFNet-DG,5,293,oxaliplatin,121,0.5752312206742337,0.8394914468016624,1.0,0.9333333333333333,0.11570247933884298,0.04987711583639076,0.10772893059117675,0.71178914313736,0.15462691382154642,1.0,nausea; headache; vomiting; diarrhoea; dizziness,injection site reaction; hyponatraemia; phlebitis; anaphylactic shock; dysuria
CAFNet,5,298,pantoprazole,57,0.4244640697259166,0.831957160778146,0.7909506325094736,0.5333333333333333,0.14035087719298245,0.017543859649122806,0.14165538260615046,0.502354822770737,0.11420951379646067,0.9333333333333333,headache; nausea; dizziness; fatigue; asthenia,toxic epidermal necrolysis; hepatic enzyme increased; stevens-johnson syndrome; erythema multiforme; angioedema
CAFNet-D,5,298,pantoprazole,57,0.4655462922669803,0.8843266116197644,0.933745776545611,0.8,0.21052631578947367,0.018867924528301886,0.09308615491651205,0.5222329035463018,0.07361405182445831,1.0,nausea; vomiting; headache; diarrhoea; dizziness,hepatic enzyme increased; hallucination; liver function test abnormal; blood triglycerides increased; hypertriglyceridaemia
CAFNet-DG,5,298,pantoprazole,57,0.47679651982116894,0.895729184219888,0.9305687780632227,0.8,0.21052631578947367,0.024390243902439025,0.13198074792953607,0.5343823240107395,0.08961565919564848,1.0,headache; nausea; diarrhoea; dizziness; vomiting,hepatic enzyme increased; angioedema; hallucination; liver function test abnormal; jaundice
CAFNet,5,317,progesterone,29,0.41198689545371997,0.9403966410577095,0.4526016377006498,0.5333333333333333,0.27586206896551724,0.005376344086021506,0.5,0.440397155184282,0.40211431878714365,0.8,pain; dizziness; headache; breast pain; asthenia,breast pain; mood swings; affect lability; vaginal discharge; breast tenderness
CAFNet-D,5,317,progesterone,29,0.6136906724896253,0.9643737716633911,0.84860265890399,0.7333333333333333,0.3793103448275862,0.015873015873015872,0.5,0.6457642471755018,0.2985121371706737,1.0,headache; dizziness; asthenia; nausea; diarrhoea,vaginal discharge; breast pain; vaginal haemorrhage; mood swings; affect lability
CAFNet-DG,5,317,progesterone,29,0.6119114607350423,0.9620510988029302,0.8701249883466594,0.7333333333333333,0.3793103448275862,0.014285714285714285,1.0,0.6399528051116301,0.4263336906089077,0.9333333333333333,headache; dizziness; asthenia; nausea; fatigue,breast pain; mood swings; vaginal discharge; affect lability; vaginal haemorrhage
CAFNet,5,321,quazepam,6,0.17012679055361984,0.9802631578947367,0.1008674711662712,0.2,0.5,,,0.17012679055361982,,1.0,asthenia; fatigue; headache; dizziness; somnolence,
CAFNet-D,5,321,quazepam,6,0.6555555555555556,0.9969635627530364,0.7742158010001622,0.3333333333333333,0.8333333333333334,,,0.6555555555555556,,1.0,dizziness; headache; asthenia; somnolence; fatigue,
CAFNet-DG,5,321,quazepam,6,0.5277777777777778,0.9949392712550608,0.6554779860295875,0.3333333333333333,0.8333333333333334,,,0.5277777777777778,,1.0,dizziness; headache; asthenia; fatigue; somnolence,
CAFNet,5,326,ramipril,26,0.5631043946316213,0.9595518118245391,0.7799082337019198,0.6666666666666666,0.38461538461538464,0.017241379310344827,,0.5926405564702795,0.08923627231671802,0.8666666666666667,shock; syncope; dizziness; loss of consciousness; headache,cerebrovascular accident; renal impairment; angioedema; arthritis; lower respiratory tract infection
CAFNet-D,5,326,ramipril,26,0.5314839731817451,0.9373013350286077,0.793584067764911,0.6666666666666666,0.38461538461538464,0.004672897196261682,,0.5623924385004077,0.034352244726905574,1.0,headache; nausea; dizziness; diarrhoea; vomiting,cerebrovascular accident; renal impairment; angioedema; arthritis; lower respiratory tract infection
CAFNet-DG,5,326,ramipril,26,0.6035726746636538,0.9467180546726002,0.914856882358379,0.6666666666666666,0.38461538461538464,0.005208333333333333,,0.631546882199538,0.07658295210288278,1.0,dizziness; headache; nausea; diarrhoea; asthenia,cerebrovascular accident; renal impairment; angioedema; arthritis; lower respiratory tract infection
CAFNet,5,327,sirolimus,63,0.4592643104050775,0.8585920583772356,0.7819835854675755,0.6666666666666666,0.15873015873015872,0.09672809864567297,0.060413151301324325,0.5807309555615715,0.10208633410105268,0.8666666666666667,body temperature increased; nausea; hypertension; pain; diarrhoea,sepsis; blood creatinine increased; herpes simplex; pericardial effusion; herpes zoster
CAFNet-D,5,327,sirolimus,63,0.4935236118443729,0.8628032666700766,0.8263333286520083,0.6666666666666666,0.15873015873015872,0.03355660280425598,0.08817647663341444,0.5847047930015438,0.15003158842673442,1.0,nausea; vomiting; diarrhoea; dermatitis; rash,sepsis; blood creatinine increased; hypophosphataemia; hypertriglyceridaemia; herpes simplex
CAFNet-DG,5,327,sirolimus,63,0.5039923771282352,0.8695207406270778,0.8415908474314976,0.8,0.19047619047619047,0.06489293669551856,0.07945526695526696,0.6007689079518754,0.1336097666117939,1.0,nausea; diarrhoea; vomiting; body temperature increased; dermatitis,sepsis; blood creatinine increased; herpes simplex; pericardial effusion; herpes zoster
CAFNet,5,337,ropinirole,396,0.7017675563390111,0.7612791797574406,0.9305687780632227,0.9333333333333333,0.03535353535353535,0.2349968595299142,0.4312300848413634,0.8254067966391707,0.5602013427202803,0.9333333333333333,dizziness; somnolence; musculoskeletal discomfort; visual impairment; hypoaesthesia,skin disorder; lethargy; muscular weakness; gastroenteritis; abdominal distension
CAFNet-D,5,337,ropinirole,396,0.6264201129014455,0.7005971082058038,0.8899541168509599,0.8666666666666667,0.03282828282828283,0.16014705648208838,0.30367698261374937,0.7830620824678673,0.4437541372995732,1.0,nausea; dizziness; vomiting; asthenia; diarrhoea,skin disorder; haemoglobin decreased; lethargy; bone pain; hyponatraemia
CAFNet-DG,5,337,ropinirole,396,0.6572426728208007,0.7231470220600656,0.8899541168509599,0.8666666666666667,0.03282828282828283,0.16838452311176177,0.32072242091325665,0.8015251580302984,0.4834812084101126,1.0,dizziness; nausea; asthenia; diarrhoea; vomiting,skin disorder; lethargy; abnormal dreams; abdominal distension; muscular weakness
CAFNet,5,341,sertraline,264,0.6236649229747447,0.7734173931091739,1.0,1.0,0.056818181818181816,0.0571405638133722,0.2850462592344195,0.7791792731452322,0.45126999208340973,0.8666666666666667,somnolence; nausea; headache; insomnia; hallucination,hallucination; abdominal distension; hyperventilation; nightmare; thinking abnormal
CAFNet-D,5,341,sertraline,264,0.6558000590478422,0.8039279784142798,1.0,1.0,0.056818181818181816,0.14221460058711144,0.21857189612235367,0.8196768454350891,0.4265568551413411,1.0,headache; dizziness; nausea; asthenia; somnolence,abnormal dreams; increased appetite; libido decreased; disturbance in sexual arousal; migraine
CAFNet-DG,5,341,sertraline,264,0.6821856231303755,0.8222965960979659,1.0,1.0,0.056818181818181816,0.11086873658559883,0.2430879840257822,0.8219625048454704,0.48922734820410513,1.0,headache; somnolence; nausea; dizziness; asthenia,hallucination; increased appetite; mental disability; nightmare; ataxia
CAFNet,5,344,sotalol,54,0.48634006946284425,0.8493301812450749,0.7314470771099788,0.8,0.2222222222222222,0.08210278016389196,0.11920981450220855,0.5688052354514423,0.10632622137967507,0.9333333333333333,nausea; diarrhoea; dizziness; hypotension; vomiting,abdominal distension; ventricular tachycardia; arrhythmia; torsade de pointes; cardiac failure
CAFNet-D,5,344,sotalol,54,0.5604937587907952,0.92876280535855,0.7104770117651424,0.8,0.2222222222222222,0.09245622647684502,0.23714742126419194,0.6314108332204957,0.22574456172257193,1.0,dizziness; nausea; diarrhoea; vomiting; asthenia,affect lability; mood swings; sexual dysfunction; arrhythmia; abdominal distension
CAFNet-DG,5,344,sotalol,54,0.5655916738990151,0.9293341213553981,0.7065443116025597,0.8666666666666667,0.24074074074074073,0.0870499419279907,0.180560309433796,0.639766200310819,0.17128010249367084,1.0,nausea; dizziness; diarrhoea; vomiting; asthenia,abdominal distension; affect lability; mood swings; arrhythmia; sexual dysfunction
CAFNet,5,348,streptozocin,11,0.1651074588946204,0.8396374734116342,0.2489083270225946,0.13333333333333333,0.18181818181818182,0.015151515151515152,0.029411764705882353,0.1973504624122704,0.023232315986770016,1.0,diarrhoea; feeling abnormal; thrombocytopenia; body temperature increased; confusional state,lethargy; hepatotoxicity; pancytopenia; injection site pain; hypoglycaemia
CAFNet-D,5,348,streptozocin,11,0.10926472835148515,0.9126051974475169,0.09478836436955075,0.13333333333333333,0.18181818181818182,0.16666666666666666,0.015151515151515152,0.12316790114103704,0.11514578208731133,1.0,diarrhoea; body temperature increased; thrombocytopenia; feeling abnormal; confusional state,injection site pain; lethargy; pancytopenia; hypoglycaemia; nephropathy toxic
CAFNet-DG,5,348,streptozocin,11,0.10948909823783755,0.8958660871173587,0.1100458831490401,0.06666666666666667,0.09090909090909091,0.07142857142857142,0.02127659574468085,0.12583041648014925,0.05206278289611623,1.0,diarrhoea; body temperature increased; thrombocytopenia; feeling abnormal; confusional state,lethargy; pancytopenia; injection site pain; hypoglycaemia; nephropathy toxic
CAFNet,5,354,temazepam,12,0.3323241224303049,0.8955363204344873,0.5455206287241074,0.4,0.5,,0.0070921985815602835,0.39865496584630866,0.00908395045450883,0.8,dizziness; somnolence; fatigue; asthenia; diarrhoea,lethargy; euphoric mood; hangover
CAFNet-D,5,354,temazepam,12,0.27858289302589073,0.9521384928716903,0.3469511918686966,0.3333333333333333,0.4166666666666667,,0.017543859649122806,0.30021557958645967,0.08774708410067526,1.0,dizziness; asthenia; diarrhoea; fatigue; somnolence,lethargy; euphoric mood; hangover
CAFNet-DG,5,354,temazepam,12,0.3566428222508553,0.9473862864901561,0.5428183923453894,0.3333333333333333,0.4166666666666667,,0.01694915254237288,0.38727527527999617,0.04378259838786154,1.0,dizziness; asthenia; diarrhoea; fatigue; somnolence,lethargy; euphoric mood; hangover
CAFNet,5,355,temozolomide,164,0.3594121683240343,0.7217087863649722,0.6285108926059099,0.6666666666666666,0.06097560975609756,0.040175927691908454,0.13172240919771483,0.5189044549759623,0.18685454542109148,0.6,headache; vomiting; abdominal distension; gastrointestinal pain; abdominal pain,abdominal distension; cerebral haemorrhage; gamma-glutamyltransferase increased; menorrhagia; influenza like illness
